{
  "schemaVersion": 1,
  "databaseVersion": "2026.06.24",
  "name": "Windows Telemetry Remover database",
  "description": "Declarative checks and disable actions for Windows privacy-related services, policies, tasks, recommendations, feedback, synchronization, diagnostic upload, and crash reporting.",
  "agentInstructions": [
    "Keep every id stable, lowercase, and unique.",
    "Use valid JSON without comments because Windows PowerShell 5.1 rejects JSON comments.",
    "Do not place executable PowerShell in the database. Use only supported typed checks and actions.",
    "Set exfiltration to yes, possible, or no for every item.",
    "Set severity and severityReason for every item from an enterprise secret-protection perspective.",
    "Set threatProofUrl, threatProofExactQuote, fixProofUrl, and fixProofExactQuote for every item.",
    "fixProofExactQuote must prove the exact target state or command effect used by disableActions; do not use generic product documentation, policy index text, or quotes that only prove a related feature exists.",
    "threatProofExactQuote must prove the threat itself: collection, transmission, cloud processing, synchronization, account linkage, stored sensitive material, or another concrete data-exposure mechanism; do not use quotes that only describe the fix, disabled state, or policy name.",
    "Items should normally use one disableAction per proof; if multiple actions are grouped, threatProofExactQuote and fixProofExactQuote must clearly cover every action in the group.",
    "Set enableActions for every item so users can see how to turn the Windows feature back on.",
    "Review downsides before adding an item to disable-all behavior.",
    "checkCommands are documentation for humans and agents; the engine does not execute them.",
    "Set applicableWindowsEditions and applicabilityNote for every item; isApplicable is computed at runtime from the current Windows edition family."
  ],
  "items": [
    {
      "id": "service.diagtrack",
      "name": "Connected User Experiences and Telemetry (DiagTrack)",
      "category": "Telemetry service",
      "scope": "machine",
      "description": "Collects and routes Windows diagnostic and telemetry events according to the configured diagnostic-data level.",
      "exfiltration": "yes",
      "severity": "high",
      "severityReason": "diagnostic telemetry can include device, app, and managed-environment signals",
      "threatProofUrl": "https://learn.microsoft.com/windows/privacy/configure-windows-diagnostic-data-in-your-organization",
      "threatProofExactQuote": "Windows diagnostic data is vital technical data",
      "fixProofUrl": "https://learn.microsoft.com/powershell/module/microsoft.powershell.management/set-service",
      "fixProofExactQuote": "`Disabled` - The service is disabled and cannot be started by a user or application.",
      "downsides": "Windows diagnostics, troubleshooting, Endpoint Analytics, and some managed-device reporting can become incomplete.",
      "checkCommands": [
        "Get-CimInstance Win32_Service -Filter \"Name='DiagTrack'\" | Select-Object Name, State, StartMode"
      ],
      "checks": [
        {
          "type": "serviceDisabled",
          "name": "DiagTrack"
        }
      ],
      "disableActions": [
        {
          "type": "disableService",
          "name": "DiagTrack"
        }
      ],
      "enableActions": [
        {
          "type": "enableService",
          "name": "DiagTrack",
          "startupType": "Automatic"
        }
      ],
      "references": [
        "https://learn.microsoft.com/windows/privacy/configure-windows-diagnostic-data-in-your-organization"
      ],
      "applicableWindowsEditions": [
        "All supported Windows editions"
      ],
      "applicabilityNote": "applies where the DiagTrack service exists"
    },
    {
      "id": "service.dmwappushservice",
      "name": "Device Management WAP Push routing service",
      "category": "Device management service",
      "scope": "machine",
      "description": "Routes Wireless Application Protocol push messages used by Windows device-management scenarios.",
      "exfiltration": "possible",
      "severity": "medium",
      "severityReason": "device-management traffic can expose management state in enrolled environments",
      "threatProofUrl": "https://learn.microsoft.com/troubleshoot/mem/intune/cannot-sync-windows-10-devices",
      "threatProofExactQuote": "The dmwappushservice service is required on client devices",
      "fixProofUrl": "https://learn.microsoft.com/powershell/module/microsoft.powershell.management/set-service",
      "fixProofExactQuote": "`Disabled` - The service is disabled and cannot be started by a user or application.",
      "downsides": "Microsoft Intune, mobile-device management, work or school management, and remote policy delivery can stop working correctly.",
      "checkCommands": [
        "Get-CimInstance Win32_Service -Filter \"Name='dmwappushservice'\" | Select-Object Name, State, StartMode"
      ],
      "checks": [
        {
          "type": "serviceDisabled",
          "name": "dmwappushservice"
        }
      ],
      "disableActions": [
        {
          "type": "disableService",
          "name": "dmwappushservice"
        }
      ],
      "enableActions": [
        {
          "type": "enableService",
          "name": "dmwappushservice",
          "startupType": "Manual"
        }
      ],
      "references": [
        "https://learn.microsoft.com/troubleshoot/mem/intune/cannot-sync-windows-10-devices"
      ],
      "applicableWindowsEditions": [
        "All supported Windows editions"
      ],
      "applicabilityNote": "applies where the dmwappushservice service exists; mainly relevant to managed/MDM devices"
    },
    {
      "id": "windows-error-reporting",
      "name": "Windows Error Reporting",
      "category": "Crash reporting",
      "scope": "machine",
      "description": "Collects information about application, operating-system, and hardware failures and can send reports to Microsoft.",
      "exfiltration": "yes",
      "severity": "high",
      "severityReason": "crash reports can include process, module, and failure-context details",
      "threatProofUrl": "https://learn.microsoft.com/windows/win32/wer/windows-error-reporting",
      "threatProofExactQuote": "enables users to notify Microsoft of application faults, kernel faults, unresponsive applications, and other application specific problems",
      "fixProofUrl": "https://learn.microsoft.com/powershell/module/windowserrorreporting/disable-windowserrorreporting",
      "fixProofExactQuote": "The Disable-WindowsErrorReporting cmdlet disables Windows Error Reporting",
      "downsides": "Automatic crash reporting, online problem solutions, and some diagnostic workflows will no longer work.",
      "checkCommands": [
        "Get-WindowsErrorReporting",
        "Get-CimInstance Win32_Service -Filter \"Name='WerSvc'\" | Select-Object Name, State, StartMode"
      ],
      "checks": [
        {
          "type": "werDisabled"
        },
        {
          "type": "serviceDisabled",
          "name": "WerSvc"
        },
        {
          "type": "registryDwordEquals",
          "path": "HKLM:\\SOFTWARE\\Microsoft\\Windows\\Windows Error Reporting",
          "name": "Disabled",
          "value": 1,
          "missingIsIssue": true
        }
      ],
      "disableActions": [
        {
          "type": "disableWer"
        },
        {
          "type": "setRegistryDword",
          "path": "HKLM:\\SOFTWARE\\Microsoft\\Windows\\Windows Error Reporting",
          "name": "Disabled",
          "value": 1
        },
        {
          "type": "disableService",
          "name": "WerSvc"
        }
      ],
      "enableActions": [
        {
          "type": "enableWer"
        },
        {
          "type": "setRegistryDword",
          "path": "HKLM:\\SOFTWARE\\Microsoft\\Windows\\Windows Error Reporting",
          "name": "Disabled",
          "value": 0
        },
        {
          "type": "enableService",
          "name": "WerSvc",
          "startupType": "Manual"
        }
      ],
      "references": [
        "https://learn.microsoft.com/powershell/module/windowserrorreporting/disable-windowserrorreporting"
      ],
      "applicableWindowsEditions": [
        "All supported Windows editions"
      ],
      "applicabilityNote": "applies where Windows Error Reporting is available"
    },
    {
      "id": "local-dumps.machine",
      "name": "Machine-wide local crash-dump collection",
      "category": "Crash dumps",
      "scope": "machine",
      "description": "Windows Error Reporting LocalDumps registry keys can create local process dump files after application crashes.",
      "exfiltration": "yes",
      "severity": "medium",
      "severityReason": "local dumps can stage process memory with credentials or proprietary data for later collection, upload, or support-bundle exfiltration",
      "threatProofUrl": "https://learn.microsoft.com/windows/win32/wer/collecting-user-mode-dumps",
      "threatProofExactQuote": "full user-mode dumps are collected and stored locally after a user-mode application crashes",
      "fixProofUrl": "https://learn.microsoft.com/windows/win32/wer/collecting-user-mode-dumps",
      "fixProofExactQuote": "This feature is not enabled by default. To enable and configure the feature, use the following registry values under the HKEY_LOCAL_MACHINE\\SOFTWARE\\Microsoft\\Windows\\Windows Error Reporting\\LocalDumps key.",
      "downsides": "Local crash dumps will not be generated for debugging applications and native crashes.",
      "checkCommands": [
        "Test-Path 'HKLM:\\SOFTWARE\\Microsoft\\Windows\\Windows Error Reporting\\LocalDumps'",
        "Test-Path 'HKLM:\\SOFTWARE\\WOW6432Node\\Microsoft\\Windows\\Windows Error Reporting\\LocalDumps'"
      ],
      "checks": [
        {
          "type": "registryKeyAbsent",